{
  "schema": "https://ai-atoms.com/schemas/skill-v1.json",
  "type": "skill",
  "id": "skill/template-instantiation",
  "version": "1.0.0",
  "name": "template-instantiation",
  "description": ">",
  "system_prompt_fragment": "# Template Instantiation\n\nThis skill creates .NET projects from templates using `dotnet new` CLI commands, with guidance for parameter validation, Central Package Management adaptation, and multi-project composition.\n\n## When to Use\n\n- User asks to create a new .NET project, app, or service\n- User needs a solution with multiple projects (API + tests + library)\n- User wants to create a project that respects existing `Directory.Packages.props`\n- User needs to install or manage template packages\n\n## When Not to Use\n\n- User is searching for or comparing templates — route to `template-discovery` skill\n- User wants to author a custom template — route to `template-authoring` skill\n- User wants to add packages to an existing project — use `dotnet add package` directly\n\n## Inputs\n\n| Input | Required | Description |\n|-------|----------|-------------|\n| Template name or intent | Yes | Template short name (e.g., `webapi`) or natural-language description |\n| Project name | Yes | Name for the created project |\n| Output path | Recommended | Directory where the project should be created |\n| Parameters | No | Template-specific parameters (e.g., `--framework`, `--auth`, `--aot`) |\n\n## Workflow\n\n### Step 1: Resolve template and parameters\n\nIf the user provides a natural-language description, map it to a template short name (see the keyword table in the `template-discovery` skill). If they provide a template name, proceed directly.\n\nUse `dotnet new <template> --help` to review available parameters, defaults, and types for any parameters the user did not specify.\n\n### Step 2: Analyze the workspace\n\nCheck the existing solution structure before creating:\n- Is Central Package Management (CPM) enabled? Look for `Directory.Packages.props`\n- What target frameworks are in use? Check existing `.csproj` files\n- Is there a `global.json` pinning the SDK?\n\nThis ensures the new project is consistent with the workspace.\n\n### Step 3: Preview the creation\n\nUse `dotnet new <template> --dry-run` to show the user what files would be created. Confirm before proceeding.\n\n```bash\ndotnet new webapi --name MyApi --framework net10.0 --dry-run\n```\n\n### Step 4: Create the project\n\nUse `dotnet new` with the template name and all parameters:\n\n```bash\ndotnet new webapi --name MyApi --output ./src/MyApi --framework net10.0 --auth Individual\n```\n\n#### Common parameter combinations\n\n| Template | Parameters | Example |\n|----------|-----------|---------|\n| `webapi` | `--auth` (None, Individual, SingleOrg, Windows), `--aot` (native AOT) | `dotnet new webapi -n MyApi --auth Individual --aot` |\n| `webapi` | `--use-controllers` (use controllers vs minimal APIs) | `dotnet new webapi -n MyApi --use-controllers` |\n| `blazor` | `--interactivity` (None, Server, WebAssembly, Auto), `--auth` | `dotnet new blazor -n MyApp --interactivity Server` |\n| `grpc` | `--aot` (native AOT) | `dotnet new grpc -n MyService --aot` |\n| `worker` | `--aot` (native AOT) | `dotnet new worker -n MyWorker --aot` |\n\nNote: Use `dotnet new <template> --help` to see all available parameters for any template.\n\nAfter creation, if the workspace uses CPM:\n1. Check `.csproj` for inline `<PackageReference>` versions\n2. Move version attributes to `Directory.Packages.props` as `<PackageVersion>` entries\n3. Remove `Version` attributes from the `.csproj`\n\n### Step 5: Multi-project composition (optional)\n\nFor complex structures, create each project sequentially and wire them together:\n\n```bash\ndotnet new webapi --name MyApi --output ./src/MyApi\ndotnet new xunit --name MyApi.Tests --output ./tests/MyApi.Tests\ndotnet add ./tests/MyApi.Tests reference ./src/MyApi\ndotnet sln add ./src/MyApi ./tests/MyApi.Tests\n```\n\n### Step 6: Template package management\n\nInstall or uninstall template packages:\n\n```bash\ndotnet new install Microsoft.DotNet.Web.ProjectTemplates.10.0\ndotnet new uninstall Microsoft.DotNet.Web.ProjectTemplates.10.0\n```\n\n### Step 7: Post-creation verification\n\n1. Verify the project builds: `dotnet build`\n2. If added to a solution, verify `dotnet build` at the solution level\n3. If CPM was adapted, verify `Directory.Packages.props` has the new entries\n\n## Validation\n\n- [ ] Project was created successfully with the expected files\n- [ ] Project builds cleanly with `dotnet build`\n- [ ] If CPM is active, `.csproj` has no version attributes and `Directory.Packages.props` has matching entries\n- [ ] Package versions in the project are current (not stale template defaults)\n- [ ] If multi-project, all projects build and reference each other correctly\n\n## Common Pitfalls\n\n| Pitfall | Solution |\n|---------|----------|\n| Not checking for CPM before creating a project | If `Directory.Packages.props` exists, `dotnet new` creates projects with inline versions that conflict. After creation, move versions to `Directory.Packages.props` and remove them from `.csproj`. |\n| Creating projects without specifying the framework | Always specify `--framework` when the template supports multiple TFMs to avoid defaulting to an older version. |\n| Not adding the project to the solution | After creation, run `dotnet sln add` to include the project in the solution. |\n| Not verifying the project builds | Always run `dotnet build` after creation to catch missing dependencies or parameter issues early. |\n\n## More Info\n\n- [Central Package Management](https://learn.microsoft.com/nuget/consume-packages/central-package-management) — CPM documentation\n- [dotnet new](https://learn.microsoft.com/dotnet/core/tools/dotnet-new) — CLI reference",
  "applicable_domains": [
    "code",
    "dotnet",
    "engineering"
  ],
  "invocation": [
    "/template-instantiation"
  ],
  "tags": [
    "dotnet-template-engine",
    "dotnet",
    "csharp",
    "microsoft"
  ],
  "authored_by": "anthropics",
  "source_url": "https://github.com/dotnet/skills/blob/main/plugins/dotnet-template-engine/skills/template-instantiation/SKILL.md",
  "lifecycle": "stable",
  "category": "dotnet"
}
